Serial,Item,Description,File_Extensions,Category,Comments
181,IBM Content Management On Demand (CMOD),"IBM’s enterprise content management solution for on-demand publishing.", "N/A","Technology","No file extension."
182,IBM Content Manager,"An enterprise content management system.", "N/A","Technology","No file extension."
183,IBM Datapower,"An integration, security, and control appliance for enterprise IT.", "N/A","Technology","No associated file extension."
184,IBM ESB,"IBM's Enterprise Service Bus for application integration.", "N/A","Technology","No file extension."
185,IBM IFW (Information Framework), BDW (Banking Data Warehouse),"IBM frameworks for information management and banking data warehousing.", "N/A","Technology","No file extension."
186,IBM iLog/ODM,"IBM Operational Decision Manager (formerly ILOG) for business rules management.", "N/A","Technology","No associated file extension."
187,IBM InfoSphere DataStage,"An ETL tool for data integration by IBM.", "N/A","Technology","No file extension."
188,IBM Infosphere Suite - Fasttrack,"A data integration and management solution by IBM.", "N/A","Technology","No file extension."
189,IBM Infosphere Suite - Information Analyzer,"A tool for data profiling and quality analysis.", "N/A","Technology","No file extension."
190,IBM Infosphere Suite - Metadatawork bench,"A metadata management tool within IBM Infosphere.", "N/A","Technology","No file extension."
191,IBM Integration Bus(IIB)/ IBM WebSphere Message Broker,"An integration broker for enterprise application connectivity.", "N/A","Technology","No file extension."
192,IBM Master Data Management,"A solution for managing and synchronizing master data across systems.", "N/A","Technology","No file extension."
193,IBM MetaData Tool,"A tool for managing enterprise metadata.", "N/A","Technology","No associated file extension."
194,IBM Optim Archive & Implementation Engg,"A solution for data archiving and implementation engineering.", "N/A","Technology","No file extension."
195,IBM PIM (Privileged Identity Manager),"A tool for managing privileged accounts and access in an organization.", "N/A","Technology","No file extension."
196,IBM Q Radar,"A security intelligence and analytics platform by IBM.", "N/A","Technology","No file extension."
197,IBM Rational Software Architect,"A design and modeling tool for software development.", "N/A","Technology","No associated file extension."
198,IBM RIT,"An IBM tool for integration testing.", "N/A","Technology","No file extension."
199,IBM uBuild,"A build automation and software configuration management tool by IBM.", "N/A","Technology","No file extension."
200,IBM uDeploy,"A deployment automation tool by IBM.", "N/A","Technology","No file extension."
201,IBM WBE,"IBM WebSphere Business Events platform.", "N/A","Technology","No file extension."
202,IBM WCC,"IBM Web Content Collector.", "N/A","Technology","No associated file extension."
203,IBM Websphere Operational Decision Management(WODM),"IBM's decision management system for operational decisions.", "N/A","Technology","No file extension."
204,IBM Websphere Operational Decision Management(WODM)-Architect,"The architecture tool for IBM's WODM.", "N/A","Technology","No file extension."
205,IBM WebSphere portal,"An enterprise portal solution by IBM.", "N/A","Technology","No file extension."
206,IBM WebSphere Process Server,"A platform for integrating business processes.", "N/A","Technology","No file extension."
207,IBM WMB,"IBM WebSphere Message Broker.", "N/A","Technology","No associated file extension."
208,IBM WSRR,"IBM WebSphere Service Registry and Repository.", "N/A","Technology","No file extension."
209,iLOG,"A business rules management system (often related to IBM ILOG).", "N/A","Technology","No file extension."
210,IM5DB,"A database system; specific details are unclear.", "N/A","Technology","No file extension."
211,Informatica,"A data integration and ETL software suite.", "N/A","Technology","No associated file extension."
212,Informatica MDM RE (IR - Identity Resolution),"Informatica’s Master Data Management and Identity Resolution solution.", "N/A","Technology","No file extension."
213,Information architecture,"The structural design of shared information environments.", "N/A","Method","Concept; not file-based."
214,Informix,"A relational database management system by IBM.", "N/A","Technology","No file extension."
215,Interwoven,"Enterprise content management and collaboration software.", "N/A","Technology","No associated file extension."
216,iOS,"Apple's mobile operating system for iPhone and iPad.", ".ipa (exclusive)","Technology",".ipa files are exclusive to iOS apps."
217,jBPM,"An open-source business process management suite from JBoss.", ".bpmn (ambiguous), .xml (ambiguous)","Technology","Uses standard BPM file types."
218,Jrules developer,"A development environment for creating business rules (often related to ILOG).", "N/A","Technology","No file extension."
219,KDB (Kx Systems),"A high-performance time-series database system.", "N/A","Technology","No associated file extension."
220,Kofax,"An automation and document processing software suite.", "N/A","Technology","No file extension."
221,Lectora (elearning Technology),"An e-learning authoring tool for creating interactive courses.", "N/A","Tool","No specific file extension identified."
222,Life Ray,"An enterprise portal and collaboration software platform.", "N/A","Technology","No file extension."
223,Lombardi,"A business process management software solution (now part of IBM).", "N/A","Technology","No associated file extension."
224,Mahout,"An open-source machine learning library primarily for Hadoop.", "N/A","Technology","No file extension."
225,MapReduce,"A programming model for processing large data sets in parallel.", "N/A","Technology","Concept – not associated with a file extension."
226,Mark 1V,"An ambiguous item; possibly referring to a legacy system or tool.", "N/A","Technology","No file extension due to unclear context."
227,McAfee End Point Security,"Security software for protecting endpoints from threats.", "N/A","Technology","No associated file extension."
228,Metacenter,"A centralized monitoring and management tool.", "N/A","Technology","No file extension."
229,Metamatrix,"A data governance and metadata management software solution.", "N/A","Technology","No file extension."
230,Metric Stream,"A Governance, Risk and Compliance (GRC) software platform.", "N/A","Technology","No associated file extension."
231,Microstrategy,"A business intelligence and analytics platform.", "N/A","Technology","No file extension."
232,Mobile Device Infrastructure,"Systems and tools for managing mobile devices and connectivity.", "N/A","Technology","No committable file type."
233,MS BI,"Microsoft Business Intelligence solutions for data analytics.", "N/A","Technology","No file extension."
234,MS Dynamic CRM,"Microsoft's customer relationship management (CRM) solution.", "N/A","Technology","No file extension."
235,Mule ESB,"An integration platform and enterprise service bus by MuleSoft.", "N/A","Technology","No associated file extension."
236,Murex - Risk Management Product,"An integrated platform for trading, risk, and processing by Murex.", "N/A","Technology","No file extension."
237,NAS,"Network Attached Storage devices for centralized data storage.", "N/A","Technology","Hardware/technology – no file extension."
238,Netezza,"A data warehouse appliance provided by IBM.", "N/A","Technology","No associated file extension."
239,NICE,"A software suite for customer engagement and analytics.", "N/A","Technology","No file extension."
240,Node.JS,"A JavaScript runtime built on Chrome's V8 engine for server-side development.", ".js (ambiguous), .json (ambiguous)","Technology","Uses standard web file types."
241,NoSQL DB,"Non-relational database systems used for flexible data models.", "N/A","Technology","Concept – no exclusive file extension."
242,OBIEE,"Oracle Business Intelligence Enterprise Edition.", "N/A","Technology","No associated file extension."
243,OBPM,"Oracle Business Process Management.", "N/A","Technology","No file extension."
244,OHRMS,"Oracle Human Resource Management System.", "N/A","Technology","No file extension."
245,Oozie,"A workflow scheduler system for managing Hadoop jobs.", "N/A","Technology","No associated file extension."
246,OpenLink Endur,"An energy trading and risk management software solution.", "N/A","Technology","No file extension."
247,OpenText (Vignette) - Enterprise Content Management,"An enterprise content management solution by OpenText.", "N/A","Technology","No file extension."
248,OpenVMS,"An operating system for enterprise servers and mainframes.", "N/A","Technology","No associated file extension."
249,Optim,"A data management and performance optimization tool.", "N/A","Technology","No file extension."
250,Oracle ADF,"Oracle Application Development Framework for building enterprise apps.", ".jspx (ambiguous)","Technology","Uses Java Server Pages; extension is not exclusive."
251,Oracle BPM,"Oracle's Business Process Management solution.", "N/A","Technology","No file extension."
252,Oracle EXADATA,"Oracle's high-performance database machine for analytics.", "N/A","Technology","No associated file extension."
253,ORACLE FINANCIAL,"Oracle's suite of financial software solutions.", "N/A","Technology","No file extension."
254,Oracle Flexcube,"A core banking software solution by Oracle.", "N/A","Technology","No committable file type."
255,Oracle GoldenGate,"Real-time data integration and replication software by Oracle.", "N/A","Technology","No file extension."
256,Oracle Identity Management,"A suite for managing digital identities and access.", "N/A","Technology","No associated file extension."
257,Oracle Webcenter,"An enterprise portal and collaboration solution by Oracle.", "N/A","Technology","No file extension."
258,Parasoft,"A provider of software testing and quality assurance solutions.", "N/A","Technology","No file extension."
259,Pega / PegaRules Process Commander PRPC,"Pega's BPM and case management platform for enterprises.", "N/A","Technology","No associated file extension."
260,Perfecto - Mobile Automation, Performance and Monitoring,"A cloud-based platform for mobile application testing and monitoring.", "N/A","Technology","No file extension."
261,Performance Engineering/ Architect,"A role focused on designing systems for optimal performance.", "N/A","Method","Job role – no file extension."
262,Performance Testing,"Testing methods that evaluate system performance under load.", "N/A","Method","Methodology; not file-based."
263,Performance Tuning and Capacity Monitoring Engineer,"A role dedicated to optimizing performance and monitoring system capacity.", "N/A","Method","Job role – no file extension."
264,Peripro,"A financial software product with unclear specifics.", "N/A","Technology","No associated file extension."
265,Portal Technologies - IBM WPS/Backbase,"Portal solutions for web experience management.", "N/A","Technology","No file extension."
266,Power Builder,"A rapid application development tool from SAP.", ".pbl (ambiguous)","Technology",".pbl files are used for PowerBuilder libraries."
267,Puppet,"An IT automation and configuration management tool.", ".pp (ambiguous)","Technology","Puppet manifest files use .pp, though it is common."
268,Python,"A high-level programming language known for its readability.", ".py (exclusive)","Technology",".py is exclusive to Python scripts."
269,QlikView,"A business intelligence platform for interactive data visualization.", "N/A","Technology","No file extension."
270,Quartz,"A job scheduling library for Java applications.", ".properties (ambiguous)","Technology","Uses configuration files; extension is generic."
271,R (Statistical Computing),"A programming language for statistical analysis and graphics.", ".R (exclusive), .r (ambiguous)","Technology",".R is exclusive for scripts; .r may be used generically."
272,RDF (Resource Description Framework),"A framework for representing information on the web.", ".rdf (exclusive)","Technology","File extension is exclusive to RDF data."
273,ReactJS,"A JavaScript library for building user interfaces.", ".jsx (ambiguous), .js (ambiguous)","Technology","JSX is common in React; .js is generic."
274,Real Time Impact,"An ambiguous term likely referring to a real-time monitoring tool.", "N/A","Technology","No file extension due to unclear context."
275,Remedy Analytics Developer,"Tools and environments for developing analytics within Remedy platforms.", "N/A","Technology","No associated file extension."
276,RSA Envision,"A risk management and compliance software solution by RSA.", "N/A","Technology","No file extension."
277,Ruby,"A dynamic programming language used for web development.", ".rb (exclusive)","Technology",".rb is exclusive to Ruby scripts."
278,Ruby on Rails,"A web application framework written in Ruby.", ".rb (ambiguous), .erb (ambiguous)","Technology","Uses Ruby and template files; extensions are not exclusive."
279,Sailpoint Security Suite,"An identity governance and management software solution.", "N/A","Technology","No file extension."
280,Salesforce - SFDC,"Salesforce's cloud-based customer relationship management (CRM) platform.", "N/A","Technology","No associated file extension."
281,Salesforce Administration,"The management and configuration of Salesforce environments.", "N/A","Method","Role and practices; not file-based."
282,Salesforce Cloud Computing,"Salesforce's suite of cloud computing services.", "N/A","Technology","No file extension."
283,SAP ABAP,"A programming language for developing applications on the SAP platform.", ".abap (exclusive)","Technology","File extension is exclusive to SAP ABAP code."
284,SAP Business Objects,"A suite of business intelligence tools by SAP.", "N/A","Technology","No file extension."
285,SAP FICO,"The financial and controlling module within SAP ERP.", "N/A","Technology","No associated file extension."
286,SAP HANA,"An in-memory, column-oriented database platform by SAP.", "N/A","Technology","No file extension."
287,SAP Netweaver,"An integrated technology platform by SAP.", "N/A","Technology","No file extension."
288,SAP-BASIS,"The administration module for SAP systems.", "N/A","Technology","No associated file extension."
289,SAP-BI,"SAP Business Intelligence tools for reporting and analytics.", "N/A","Technology","No file extension."
290,SAP-BPC,"SAP Business Planning and Consolidation software.", "N/A","Technology","No associated file extension."
291,SAP-CE/PORTAL,"SAP Customer Engagement/Portal solutions.", "N/A","Technology","No file extension."
292,SAP-ECC,"SAP ERP Central Component, the core of SAP ERP.", "N/A","Technology","No file extension."
293,SAP-PI,"SAP Process Integration for system connectivity.", "N/A","Technology","No associated file extension."
294,SAP-SECURITY,"Tools and processes for managing security within SAP systems.", "N/A","Technology","No file extension."
295,SAS,"A statistical analysis software suite.", ".sas (ambiguous), .sas7bdat (exclusive)","Technology",".sas7bdat files are exclusive; .sas files are common."
296,SAS eMiner,"A data mining and predictive analytics tool from SAS.", "N/A","Technology","No file extension."
297,SAS GRID,"A grid computing solution from SAS for distributed processing.", "N/A","Technology","No associated file extension."
298,SAS Spot fire,"An analytics and business intelligence platform by SAS.", "N/A","Technology","No file extension."
299,Savvion,"A business process management and analytics software solution.", "N/A","Technology","No associated file extension."
300,Scala,"A programming language that integrates object-oriented and functional programming.", ".scala (exclusive)","Technology","File extension is exclusive to Scala."
301,Scikit Learn (SKLearn),"A machine learning library for Python.", "N/A","Technology","Library – no exclusive file extension."
302,Selenium,"An automated testing framework for web applications.", "N/A","Technology","No associated file extension."
303,SIEBEL,"A customer relationship management (CRM) software by Oracle.", "N/A","Technology","No file extension."
304,Silanis (eSignature),"A digital signature solution for secure electronic signing.", "N/A","Technology","No file extension."
305,Silverlite,"An ambiguous term likely referring to a tool; context is unclear.", "N/A","Technology","No file extension."
306,Siperian,"A Master Data Management (MDM) platform by Informatica.", "N/A","Technology","No associated file extension."
307,Siteminder (Access Management),"An access management and single sign-on solution.", "N/A","Technology","No file extension."
308,SOAtest,"An API and service testing tool by Parasoft.", "N/A","Technology","No file extension."
309,Splunk Enterprise,"A platform for machine data analysis and operational intelligence.", "N/A","Technology","No associated file extension."
310,Spotfire,"An analytics and data visualization platform by TIBCO.", "N/A","Technology","No file extension."
311,Spring Boot,"A Java-based framework for building microservices and web applications.", ".java (ambiguous), .properties (ambiguous)","Technology","Uses standard Java file types."
312,Stratus,"An ambiguous term that may refer to fault-tolerant computing or cloud services.", "N/A","Technology","Unclear context – no file extension."
313,Sungard LDRPS,"A solution from Sungard for data recovery and protection.", "N/A","Technology","No file extension."
314,Sungard Stream GMI,"A financial software solution from Sungard.", "N/A","Technology","No associated file extension."
315,Sybase Power Designer,"A data modeling and design tool by Sybase.", ".pdm (exclusive), .apdm (ambiguous)","Technology",".pdm files are typically exclusive."
316,Symant,"An ambiguous reference likely to Symantec security solutions.", "N/A","Technology","If referring to Symantec, no file extension is committed."
317,TIBCO,"A suite of middleware and integration software solutions.", "N/A","Technology","No associated file extension."
318,TLM (Transaction Lifecycle Management),"Software for managing the lifecycle of financial transactions.", "N/A","Technology","No file extension."
319,Tosca OSV-Orchestrated Service Virtualization,"A service virtualization tool by Tricentis Tosca.", "N/A","Technology","No file extension."
320,Tosca Testsuite - Test Automation,"A test automation suite by Tricentis Tosca.", "N/A","Technology","No associated file extension."
321,TouchPoint - FIS (IBM Business Partner),"A customer engagement and relationship management platform.", "N/A","Technology","No file extension."
322,Trifacta,"A data wrangling and preparation platform.", "N/A","Technology","No file extension."
323,Trillium,"Data quality and cleansing software.", "N/A","Technology","No associated file extension."
324,TSYS,"A payment processing and financial services technology platform.", "N/A","Technology","No file extension."
325,TUXEDO,"A middleware platform for distributed transaction processing.", "N/A","Technology","No associated file extension."
326,UI Architect,"A professional role focused on designing user interfaces.", "N/A","Method","Role – not file-based."
327,UI Bootstrap,"A front-end framework for building responsive web interfaces.", ".html (ambiguous), .css (ambiguous), .js (ambiguous)","Technology","Uses standard web file types."
328,UI Canjs,"A JavaScript framework for building rich web interfaces.", ".js (ambiguous)","Technology","Standard web file type."
329,UI Designer,"A professional specializing in designing user interfaces.", "N/A","Method","Role – no file extension."
330,UI DOJO,"A JavaScript framework for building web applications.", ".js (ambiguous)","Technology","Uses standard web file type."
331,UI Kendo UI,"A JavaScript UI framework for building modern web applications.", ".js (ambiguous), .css (ambiguous)","Technology","Uses common web file types."
332,UI Kony,"A mobile application development platform.", "N/A","Technology","No associated file extension."
333,UI Sencha,"A JavaScript framework for enterprise-grade web applications.", ".js (ambiguous)","Technology","Uses standard web file type."
334,UI/UX -Bootstrap,"A front-end component library for responsive design.", ".html (ambiguous), .css (ambiguous), .js (ambiguous)","Technology","Uses common web file types."
335,Unix/Shell Scripts,"Scripts written for Unix/Linux shell environments.", ".sh (exclusive)","Technology",".sh is exclusive to shell scripts."
336,UX - Visual designers,"Professionals focused on visual design for user experience.", "N/A","Method","Role – not file-based."
337,UX Architect,"A professional who designs user experience strategies and interfaces.", "N/A","Method","Job role; no file extension."
338,UX Designers and Visual Designers,"Professionals specializing in user experience and visual design.", "N/A","Method","Role – no associated file extension."
339,UX high fidelity wire frames,"Detailed prototypes or blueprints for user interface design.", "N/A","Method","Artifacts typically created in design tools, not a specific file type."
340,Velocimetrics,"A performance measurement and analysis tool.", "N/A","Technology","No file extension."
341,Vertica,"A column-oriented database management system designed for analytics.", "N/A","Technology","No associated file extension."
342,Voice Infrastructure,"Systems that support voice communications over data networks.", "N/A","Technology","No file extension."
343,Voice Network Portfolio - all products,"A collection of products related to voice network solutions.", "N/A","Technology","No associated file extension."
344,Voice XML,"A markup language for creating voice-enabled applications.", ".xml (ambiguous)","Technology","XML is a generic format."
345,Waterline,"An ambiguous term likely referring to a data management platform.", "N/A","Technology","No file extension due to unclear context."
346,Web Dynpro,"SAP's web application development tool for enterprise applications.", "N/A","Technology","No file extension."
347,Web Method,"Integration software and services for connecting disparate applications.", "N/A","Technology","No associated file extension."
348,Weblogic Format,"Possibly referring to Oracle WebLogic server configuration formats.", "N/A","Technology","No file extension."
349,WebScience MQ,"A messaging queue technology; specifics are unclear.", "N/A","Technology","No associated file extension."
350,Wess,"An ambiguous term with unclear context.", "N/A","Technology","No file extension."
351,Windows/Linux Device Computer,"Computing devices running Windows or Linux operating systems.", "N/A","Technology","Hardware/OS – not associated with a committable file."
352,Worker,"A general term for a computing process or node in distributed systems.", "N/A","Technology","Concept; no exclusive file extension."
353,Xenarin,"An ambiguous item likely referring to a tool or technology; context is unclear.", "N/A","Technology","No file extension."
354,Systeme (eLearning),"An eLearning platform or system for delivering educational content.", "N/A","Technology","No associated file extension."
